{
  "id": "018f35a4-c6d2-7cb8-af5a-0a00f329c103",
  "schemaVersion": "1.0.0",
  "eventVersion": 1,
  "source": "self-healing-systems",
  "type": "heal.escalated",
  "severity": "warn",
  "timestamp": "2026-02-26T18:11:00Z",
  "correlationId": "018f35a4-c6d2-7cb8-af5a-0a00f329c102",
  "payload": {
    "reasonCode": "unknown_failure_signature",
    "humanContext": {
      "summary": "Could not classify",
      "candidateFiles": ["tests/test_compute.py"]
    }
  }
}
